{
  "schemaVersion": 1,
  "id": "9869102909a14b899a7b0a2709b271f4",
  "case": "PLAN-004",
  "caseDigest": "7039ba0b0c29ac3ec07f77b6bc96425dfe263c224d35cc851613e077d829a133",
  "stage": "regression",
  "testId": "PLAN-004",
  "platformRole": "portable",
  "actualPlatform": "windows-x86_64",
  "command": [
    "pwsh",
    "-NoProfile",
    "-File",
    "scripts/test.ps1"
  ],
  "cwd": "C:\\src\\jackage",
  "startedUtc": "2026-10-12T04:59:59.562860+00:00",
  "finishedUtc": "2026-10-12T05:00:23.756236+00:00",
  "exitCode": 0,
  "infrastructureFailure": null,
  "marker": "JCKG_EVIDENCE PLAN-004",
  "markerFound": true,
  "logPath": "state/evidence/9869102909a14b899a7b0a2709b271f4.log",
  "logSha256": "953b8d31355c1baddc67cfd777b6b002e01ac9e198439c22d80c81a3c3c524b5",
  "acceptedObservation": true,
  "sourceBefore": {
    "observationKind": "git-head-status-and-tracked-diff",
    "head": "9daddcdb70753c56b28aa2a3ae8c30e277097e4a",
    "statusSha256": "70493ab8f45c8082e6d6b328dd2a364df338d83940e7b11d125c003fe2cb889e",
    "trackedDiffSha256": "05b08fe01e39dc6a3b8e229323cdb0198e922d976996f6d8739600e1a7959329",
    "untrackedContentIncluded": false
  },
  "sourceAfter": {
    "observationKind": "git-head-status-and-tracked-diff",
    "head": "9daddcdb70753c56b28aa2a3ae8c30e277097e4a",
    "statusSha256": "70493ab8f45c8082e6d6b328dd2a364df338d83940e7b11d125c003fe2cb889e",
    "trackedDiffSha256": "05b08fe01e39dc6a3b8e229323cdb0198e922d976996f6d8739600e1a7959329",
    "untrackedContentIncluded": false
  },
  "note": "Local observation only. Review and independent CI replay remain required."
}
