{
  "schemaVersion": 1,
  "id": "7d93c06a8d5e443e93e3568563aa098c",
  "case": "EXE-006",
  "caseDigest": "fc5c3c0713c77acff7d5a066cf8548c965588d6ddfba8e239a3c93f11f1370b9",
  "stage": "fault",
  "testId": "EXE-006",
  "platformRole": "host",
  "actualPlatform": "windows-x86_64",
  "command": [
    "pwsh",
    "-NoProfile",
    "-File",
    "scripts/test.ps1",
    "-Filter",
    "m03"
  ],
  "cwd": "C:\\src\\jackage",
  "startedUtc": "2026-10-12T09:50:31.006481+00:00",
  "finishedUtc": "2026-10-12T09:50:34.211874+00:00",
  "exitCode": 1,
  "infrastructureFailure": null,
  "marker": "JCKG_EVIDENCE EXE-006",
  "markerFound": true,
  "logPath": "state/evidence/7d93c06a8d5e443e93e3568563aa098c.log",
  "logSha256": "8de9b143696d0e4747a34f6f3c3de5c9126f9c747a9820d7e1082e46af3adc69",
  "acceptedObservation": true,
  "sourceBefore": {
    "observationKind": "git-head-status-and-tracked-diff",
    "head": "9daddcdb70753c56b28aa2a3ae8c30e277097e4a",
    "statusSha256": "c605589f34cdbd41fbab85b92c39c530a9c52868017ab8d1e7958f2274c521d4",
    "trackedDiffSha256": "0f7fdb8ad2f880a9d0b416518337557c24da4376df43581ee7ac6cee0abe6697",
    "untrackedContentIncluded": false
  },
  "sourceAfter": {
    "observationKind": "git-head-status-and-tracked-diff",
    "head": "9daddcdb70753c56b28aa2a3ae8c30e277097e4a",
    "statusSha256": "c605589f34cdbd41fbab85b92c39c530a9c52868017ab8d1e7958f2274c521d4",
    "trackedDiffSha256": "0f7fdb8ad2f880a9d0b416518337557c24da4376df43581ee7ac6cee0abe6697",
    "untrackedContentIncluded": false
  },
  "note": "Local observation only. Review and independent CI replay remain required."
}
