{
  "schemaVersion": 1,
  "id": "85ff9d3e23a24a389151fdb3e0b86737",
  "case": "PACK-005",
  "caseDigest": "4faa220e8cd9203357d676efaa91ad3d60e26befd967cc2ce5dd8dca2090cf17",
  "stage": "green",
  "testId": "m10/PACK-005 construct OCI layout: descriptors are verified against their blobs",
  "platformRole": "portable",
  "actualPlatform": "windows-x86_64",
  "command": [
    "pwsh",
    "-NoProfile",
    "-File",
    "scripts/test.ps1",
    "-Filter",
    "PACK-005"
  ],
  "cwd": "C:\\src\\jackage",
  "startedUtc": "2026-10-12T15:58:20.401058+00:00",
  "finishedUtc": "2026-10-12T15:58:24.156946+00:00",
  "exitCode": 0,
  "infrastructureFailure": null,
  "marker": "JCKG_EVIDENCE PACK-005",
  "markerFound": true,
  "logPath": "state/evidence/85ff9d3e23a24a389151fdb3e0b86737.log",
  "logSha256": "c9c7d921a0ba41ae49d93f6b27e2dcea7c747423ee02ede3156d969be8e2dea0",
  "acceptedObservation": true,
  "sourceBefore": {
    "observationKind": "git-head-status-and-tracked-diff",
    "head": "9d8813aa4237e58b338d563df1f4a659b51ede43",
    "statusSha256": "340967d4b3e585cb24b6458d0c88e2d185c6da433da092d8a779d31414b9201d",
    "trackedDiffSha256": "0171d410e00702a674978fa3a4d21a28911a1fecd347a8c3e241bfc66499ae0a",
    "untrackedContentIncluded": false
  },
  "sourceAfter": {
    "observationKind": "git-head-status-and-tracked-diff",
    "head": "9d8813aa4237e58b338d563df1f4a659b51ede43",
    "statusSha256": "2f29369414f1039ad35fe7d45a9022066691d18439ce8e8b456577490553af60",
    "trackedDiffSha256": "0171d410e00702a674978fa3a4d21a28911a1fecd347a8c3e241bfc66499ae0a",
    "untrackedContentIncluded": false
  },
  "note": "Local observation only. Review and independent CI replay remain required."
}
