{
  "schemaVersion": 1,
  "id": "f493e0f569ef4aa78fa3f12bab9d08b0",
  "case": "EVAL-008",
  "caseDigest": "51d9a0d5712f17876fa231dca722303bc7662dfd142874cf8c320b5fefcdc484",
  "stage": "fault",
  "testId": "EVAL-008",
  "platformRole": "portable",
  "actualPlatform": "windows-x86_64",
  "command": [
    "pwsh",
    "-NoProfile",
    "-File",
    "scripts/test.ps1",
    "-Filter",
    "EVAL-008"
  ],
  "cwd": "C:\\src\\jackage",
  "startedUtc": "2026-10-12T09:35:47.391460+00:00",
  "finishedUtc": "2026-10-12T09:35:50.787337+00:00",
  "exitCode": 1,
  "infrastructureFailure": null,
  "marker": "JCKG_EVIDENCE EVAL-008",
  "markerFound": true,
  "logPath": "state/evidence/f493e0f569ef4aa78fa3f12bab9d08b0.log",
  "logSha256": "57c6e02f5d8a911e8f384137317d5b1073f46018804cd7429def98be1a52926f",
  "acceptedObservation": true,
  "sourceBefore": {
    "observationKind": "git-head-status-and-tracked-diff",
    "head": "9daddcdb70753c56b28aa2a3ae8c30e277097e4a",
    "statusSha256": "c605589f34cdbd41fbab85b92c39c530a9c52868017ab8d1e7958f2274c521d4",
    "trackedDiffSha256": "0f7fdb8ad2f880a9d0b416518337557c24da4376df43581ee7ac6cee0abe6697",
    "untrackedContentIncluded": false
  },
  "sourceAfter": {
    "observationKind": "git-head-status-and-tracked-diff",
    "head": "9daddcdb70753c56b28aa2a3ae8c30e277097e4a",
    "statusSha256": "c605589f34cdbd41fbab85b92c39c530a9c52868017ab8d1e7958f2274c521d4",
    "trackedDiffSha256": "0f7fdb8ad2f880a9d0b416518337557c24da4376df43581ee7ac6cee0abe6697",
    "untrackedContentIncluded": false
  },
  "note": "Local observation only. Review and independent CI replay remain required."
}
