{
  "schemaVersion": 1,
  "id": "31ae741884254964b01ab5908e0b6c0c",
  "case": "CAN-010",
  "caseDigest": "dd40fe252c1a3aaddc84dc13cb179ade3e5abc2091782927f114d9955b6b2e53",
  "stage": "green",
  "testId": "CAN-010",
  "platformRole": "portable",
  "actualPlatform": "windows-x86_64",
  "command": [
    "pwsh",
    "-NoProfile",
    "-File",
    "scripts/test.ps1",
    "-Filter",
    "CAN"
  ],
  "cwd": "C:\\src\\jackage",
  "startedUtc": "2026-10-12T04:31:46.110336+00:00",
  "finishedUtc": "2026-10-12T04:31:46.641723+00:00",
  "exitCode": 0,
  "infrastructureFailure": null,
  "marker": "JCKG_EVIDENCE CAN-010",
  "markerFound": true,
  "logPath": "state/evidence/31ae741884254964b01ab5908e0b6c0c.log",
  "logSha256": "4da4a9ea673866a384942d55536945f55696e9f2b161764f14b5007a0a7cc38d",
  "acceptedObservation": true,
  "sourceBefore": {
    "observationKind": "git-head-status-and-tracked-diff",
    "head": "9daddcdb70753c56b28aa2a3ae8c30e277097e4a",
    "statusSha256": "f1c69e84fc28dfb284c7f1d27b25306ff74bfd8a01e88bc8180ced1c32f99ea8",
    "trackedDiffSha256": "f91693064e164b45996819abacaea57691865323ffe38c792bcd7afe72c256c3",
    "untrackedContentIncluded": false
  },
  "sourceAfter": {
    "observationKind": "git-head-status-and-tracked-diff",
    "head": "9daddcdb70753c56b28aa2a3ae8c30e277097e4a",
    "statusSha256": "f1c69e84fc28dfb284c7f1d27b25306ff74bfd8a01e88bc8180ced1c32f99ea8",
    "trackedDiffSha256": "f91693064e164b45996819abacaea57691865323ffe38c792bcd7afe72c256c3",
    "untrackedContentIncluded": false
  },
  "note": "Local observation only. Review and independent CI replay remain required."
}
