{
  "schemaVersion": 1,
  "id": "feb502db565b4d3ba82c9dc385f6ae24",
  "case": "IMAGE-002",
  "caseDigest": "aa0bd0013040681975c1f50a7be4fc801b805958794ff942e78974f0df67e056",
  "stage": "green",
  "testId": "m15/IMAGE-002 run development image: declared tools execute on native guest storage",
  "platformRole": "linux-x86_64",
  "actualPlatform": "linux-x86_64",
  "command": [
    "sh",
    "scripts/test.sh",
    "IMAGE-002"
  ],
  "cwd": "/home/autark/jckg/dev",
  "startedUtc": "2026-10-12T18:39:22.644556+00:00",
  "finishedUtc": "2026-10-12T18:43:30.027996+00:00",
  "exitCode": 0,
  "infrastructureFailure": null,
  "marker": "JCKG_EVIDENCE IMAGE-002",
  "markerFound": true,
  "logPath": "state/evidence/feb502db565b4d3ba82c9dc385f6ae24.log",
  "logSha256": "c269045c984054cfd5164a5790dc71bfc58d5341c65908f2d7f4c4c2dc68163a",
  "acceptedObservation": true,
  "sourceBefore": {
    "observationKind": "git-head-status-and-tracked-diff",
    "head": null,
    "statusSha256": null,
    "trackedDiffSha256": null,
    "untrackedContentIncluded": false
  },
  "sourceAfter": {
    "observationKind": "git-head-status-and-tracked-diff",
    "head": null,
    "statusSha256": null,
    "trackedDiffSha256": null,
    "untrackedContentIncluded": false
  },
  "note": "Local observation only. Review and independent CI replay remain required."
}
