{
  "schemaVersion": 1,
  "id": "f94f2d6bae634bd09ec6f64718e3763b",
  "case": "EVAL-007",
  "caseDigest": "0d8683181c1deb7a18e1a67b12639f3699a5ed62ca1fb7f5790fcec69821e6d6",
  "stage": "green",
  "testId": "EVAL-007",
  "platformRole": "portable",
  "actualPlatform": "windows-x86_64",
  "command": [
    "pwsh",
    "-NoProfile",
    "-File",
    "scripts/test.ps1",
    "-Filter",
    "EVAL-007"
  ],
  "cwd": "C:\\src\\jackage",
  "startedUtc": "2026-10-12T09:37:44.934129+00:00",
  "finishedUtc": "2026-10-12T09:37:48.918889+00:00",
  "exitCode": 0,
  "infrastructureFailure": null,
  "marker": "JCKG_EVIDENCE EVAL-007",
  "markerFound": true,
  "logPath": "state/evidence/f94f2d6bae634bd09ec6f64718e3763b.log",
  "logSha256": "029b755324d0d8e517facb0c022e892b771ae18a731cc73f96290486535f153b",
  "acceptedObservation": true,
  "sourceBefore": {
    "observationKind": "git-head-status-and-tracked-diff",
    "head": "9daddcdb70753c56b28aa2a3ae8c30e277097e4a",
    "statusSha256": "c605589f34cdbd41fbab85b92c39c530a9c52868017ab8d1e7958f2274c521d4",
    "trackedDiffSha256": "0f7fdb8ad2f880a9d0b416518337557c24da4376df43581ee7ac6cee0abe6697",
    "untrackedContentIncluded": false
  },
  "sourceAfter": {
    "observationKind": "git-head-status-and-tracked-diff",
    "head": "9daddcdb70753c56b28aa2a3ae8c30e277097e4a",
    "statusSha256": "c605589f34cdbd41fbab85b92c39c530a9c52868017ab8d1e7958f2274c521d4",
    "trackedDiffSha256": "0f7fdb8ad2f880a9d0b416518337557c24da4376df43581ee7ac6cee0abe6697",
    "untrackedContentIncluded": false
  },
  "note": "Local observation only. Review and independent CI replay remain required."
}
