{
  "schemaVersion": 1,
  "id": "42737632b33e423a8bd30b1461006dd7",
  "case": "CLI-008",
  "caseDigest": "e34e8c1070af668f2032eac8055e1d19e99f13581df4b8b15e89506c09eb413a",
  "stage": "green",
  "testId": "CLI-008",
  "platformRole": "host",
  "actualPlatform": "windows-x86_64",
  "command": [
    "pwsh",
    "-NoProfile",
    "-File",
    "scripts/test.ps1",
    "-Filter",
    "CLI"
  ],
  "cwd": "C:\\src\\jackage",
  "startedUtc": "2026-10-12T05:06:16.599641+00:00",
  "finishedUtc": "2026-10-12T05:06:24.242067+00:00",
  "exitCode": 0,
  "infrastructureFailure": null,
  "marker": "JCKG_EVIDENCE CLI-008",
  "markerFound": true,
  "logPath": "state/evidence/42737632b33e423a8bd30b1461006dd7.log",
  "logSha256": "16aca9d69b0440b7583593fa7f10401552ced807d98291f461d527ad3bc9d054",
  "acceptedObservation": true,
  "sourceBefore": {
    "observationKind": "git-head-status-and-tracked-diff",
    "head": "9daddcdb70753c56b28aa2a3ae8c30e277097e4a",
    "statusSha256": "241abe3906101fa36e667ce9872f509af1b6baa11faa7b87572fb5e1d17dbeac",
    "trackedDiffSha256": "05b08fe01e39dc6a3b8e229323cdb0198e922d976996f6d8739600e1a7959329",
    "untrackedContentIncluded": false
  },
  "sourceAfter": {
    "observationKind": "git-head-status-and-tracked-diff",
    "head": "9daddcdb70753c56b28aa2a3ae8c30e277097e4a",
    "statusSha256": "241abe3906101fa36e667ce9872f509af1b6baa11faa7b87572fb5e1d17dbeac",
    "trackedDiffSha256": "05b08fe01e39dc6a3b8e229323cdb0198e922d976996f6d8739600e1a7959329",
    "untrackedContentIncluded": false
  },
  "note": "Local observation only. Review and independent CI replay remain required."
}
